id_266,Female,56,United Kingdom of Great Britain and Northern Ireland,"Yes, English is my fluent language and also my native language.","1. Professional and technical (for example: doctor, teacher, engineer, artist, accountant, nurse)",9. Nineth step,7. Master or equivalent (ISCED 7),4. Working class,2. Protestant,Moderately Accurate,Moderately Accurate,Moderately Inaccurate,Moderately Inaccurate,Moderately Inaccurate,Very Inaccurate,Moderately Accurate,Moderately Inaccurate,Very Accurate,Moderately Accurate,Moderately Inaccurate,Moderately Accurate,Very Inaccurate,Moderately Inaccurate,Moderately Accurate,Moderately Inaccurate,Moderately Inaccurate,Very Accurate,Moderately Accurate,Moderately Inaccurate,Moderately Accurate,Moderately Inaccurate,Moderately Accurate,Very Inaccurate,Moderately Inaccurate,Moderately Accurate,Moderately Inaccurate,Neither inaccurate nor accurate,Moderately Accurate,Moderately Accurate,Neither inaccurate nor accurate,Very Accurate,Moderately Inaccurate,Moderately Accurate,Moderately Accurate,Moderately Accurate,Moderately Accurate,Moderately Inaccurate,Moderately Accurate,Moderately Accurate,Moderately Accurate,Moderately Inaccurate,Moderately Accurate,Moderately Accurate,Moderately Accurate,Moderately Accurate,Moderately Accurate,Moderately Accurate,Moderately Accurate,Moderately Inaccurate,Moderately Accurate,Moderately Accurate,Moderately Accurate,Moderately Accurate,Very Inaccurate,Moderately Accurate,Very Inaccurate,Neither inaccurate nor accurate,Neither inaccurate nor accurate,Neither inaccurate nor accurate,Moderately Accurate,Moderately Inaccurate,Very Inaccurate,Moderately Inaccurate,Moderately Inaccurate,Moderately Inaccurate,Very Accurate,Moderately Inaccurate,Neither inaccurate nor accurate,Moderately Inaccurate,Very Inaccurate,Very Inaccurate,Very Accurate,Moderately Inaccurate,Very Inaccurate,Moderately Accurate,Moderately Accurate,Moderately Inaccurate,Moderately Accurate,Moderately Accurate,Moderately Inaccurate,Moderately Accurate,Moderately Inaccurate,Very Inaccurate,Moderately Accurate,Very Accurate,Neither inaccurate nor accurate,Moderately Accurate,Very Accurate,Moderately Inaccurate,Moderately Inaccurate,Moderately Inaccurate,Moderately Accurate,Moderately Inaccurate,Moderately Accurate,Moderately Accurate,Neither inaccurate nor accurate,Moderately Accurate,Moderately Accurate,Moderately Accurate,Moderately Inaccurate,Moderately Inaccurate,Moderately Inaccurate,Moderately Accurate,Moderately Accurate,Moderately Accurate,Moderately Accurate,Neither inaccurate nor accurate,Moderately Accurate,Moderately Accurate,Moderately Inaccurate,Moderately Accurate,Moderately Accurate,Neither inaccurate nor accurate,Moderately Inaccurate,Moderately Accurate,Moderately Inaccurate,Neither inaccurate nor accurate,Very Inaccurate,Very Accurate,Moderately Accurate,Moderately Accurate,Neither inaccurate nor accurate,Moderately Accurate,Moderately Accurate,Moderately Accurate,Moderately Accurate,Moderately Inaccurate,Neither inaccurate nor accurate,Moderately Accurate,Very Inaccurate,Moderately Accurate,Moderately Accurate,Moderately Accurate,Very Inaccurate,Neither inaccurate nor accurate,Very Inaccurate,Moderately Inaccurate,Moderately Inaccurate,Very Inaccurate,Moderately Inaccurate,Moderately Inaccurate,Very Accurate,Very Inaccurate,Moderately Accurate,Moderately Accurate,Moderately Accurate,Neither inaccurate nor accurate,Moderately Accurate,Moderately Accurate,Very Inaccurate,Moderately Accurate,Moderately Inaccurate,Moderately Inaccurate,Moderately Inaccurate,Moderately Accurate,Moderately Inaccurate,Moderately Inaccurate,Very Inaccurate,Neither inaccurate nor accurate,Moderately Accurate,Moderately Inaccurate,Moderately Inaccurate,Moderately Inaccurate,Moderately Accurate,Moderately Inaccurate,Very Inaccurate,Moderately Accurate,Moderately Inaccurate,Moderately Accurate,Moderately Inaccurate,Moderately Inaccurate,Moderately Accurate,Moderately Inaccurate,Moderately Accurate,Moderately Inaccurate,Neither inaccurate nor accurate,Moderately Accurate,Moderately Inaccurate,Very Inaccurate,Very Inaccurate,Moderately Inaccurate,Very Inaccurate,Very Inaccurate,Moderately Inaccurate,Moderately Accurate,Moderately Inaccurate,Moderately Inaccurate,Very Accurate,Moderately Accurate,Moderately Accurate,Neither inaccurate nor accurate,Moderately Inaccurate,Moderately Accurate,Moderately Accurate,Moderately Inaccurate,Moderately Inaccurate,Moderately Inaccurate,Moderately Inaccurate,Moderately Accurate,Moderately Accurate,Moderately Accurate,Moderately Inaccurate,Moderately Accurate,Moderately Accurate,Moderately Accurate,Very Inaccurate,Neither inaccurate nor accurate,Moderately Inaccurate,Moderately Inaccurate,Moderately Inaccurate,Moderately Accurate,Moderately Inaccurate,Moderately Inaccurate,Very Inaccurate,Moderately Inaccurate,Moderately Accurate,Neither inaccurate nor accurate,Moderately Accurate,Very Inaccurate,Very Inaccurate,Moderately Inaccurate,Moderately Inaccurate,Moderately Inaccurate,Neither inaccurate nor accurate,Moderately Inaccurate,Very Inaccurate,Very Inaccurate,Very Accurate,Moderately Accurate,Very Inaccurate,Moderately Inaccurate,Moderately Inaccurate,Moderately Accurate,Moderately Accurate,Moderately Accurate,Moderately Inaccurate,Neither inaccurate nor accurate,Moderately Accurate,Moderately Inaccurate,Very Inaccurate,Neither inaccurate nor accurate,Moderately Inaccurate,Very Inaccurate,Moderately Accurate,Very Inaccurate,Very Inaccurate,Moderately Inaccurate,Moderately Accurate,Moderately Accurate,Moderately Accurate,Very Inaccurate,Moderately Accurate
id_267,Female,60,United States of America,"Yes, English is my fluent language and also my native language.","3. Clerical (for example: secretary, clerk, office manager, civil servant, bookkeeper)",3. Third step,4. Post-secondary non-tertiary education (ISCED 4),4. Working class,2. Protestant,Very Accurate,Very Accurate,Very Accurate,Very Accurate,Very Accurate,Very Inaccurate,Very Accurate,Neither inaccurate nor accurate,Very Accurate,Very Accurate,Very Inaccurate,Very Accurate,Very Inaccurate,Very Inaccurate,Very Inaccurate,Very Inaccurate,Very Inaccurate,Neither inaccurate nor accurate,Very Inaccurate,Very Inaccurate,Very Accurate,Very Inaccurate,Very Accurate,Very Inaccurate,Moderately Accurate,Neither inaccurate nor accurate,Neither inaccurate nor accurate,Very Inaccurate,Neither inaccurate nor accurate,Moderately Accurate,Neither inaccurate nor accurate,Moderately Accurate,Very Inaccurate,Moderately Accurate,Moderately Accurate,Neither inaccurate nor accurate,Very Accurate,Neither inaccurate nor accurate,Neither inaccurate nor accurate,Moderately Accurate,Moderately Accurate,Moderately Accurate,Very Accurate,Very Accurate,Very Accurate,Moderately Accurate,Very Accurate,Moderately Accurate,Very Accurate,Very Accurate,Very Accurate,Moderately Inaccurate,Very Accurate,Very Accurate,Very Inaccurate,Moderately Accurate,Very Inaccurate,Very Inaccurate,Very Inaccurate,Moderately Accurate,Very Accurate,Very Inaccurate,Very Inaccurate,Moderately Accurate,Moderately Accurate,Moderately Accurate,Moderately Accurate,Very Inaccurate,Moderately Accurate,Very Inaccurate,Very Inaccurate,Very Inaccurate,Very Accurate,Very Inaccurate,Very Inaccurate,Very Inaccurate,Very Accurate,Very Inaccurate,Very Accurate,Neither inaccurate nor accurate,Moderately Accurate,Very Accurate,Very Inaccurate,Very Inaccurate,Very Inaccurate,Moderately Accurate,Very Inaccurate,Moderately Accurate,Moderately Accurate,Very Inaccurate,Moderately Accurate,Very Inaccurate,Moderately Accurate,Very Inaccurate,Moderately Accurate,Moderately Accurate,Moderately Accurate,Moderately Accurate,Moderately Accurate,Moderately Accurate,Moderately Accurate,Moderately Accurate,Moderately Accurate,Very Inaccurate,Moderately Accurate,Moderately Accurate,Very Accurate,Very Accurate,Moderately Inaccurate,Very Accurate,Very Inaccurate,Moderately Accurate,Moderately Accurate,Moderately Accurate,Moderately Accurate,Moderately Accurate,Very Inaccurate,Very Inaccurate,Very Inaccurate,Very Accurate,Very Accurate,Very Accurate,Very Accurate,Very Inaccurate,Neither inaccurate nor accurate,Very Accurate,Very Inaccurate,Very Inaccurate,Very Inaccurate,Very Accurate,Moderately Accurate,Moderately Accurate,Very Accurate,Very Accurate,Very Inaccurate,Very Accurate,Very Inaccurate,Neither inaccurate nor accurate,Very Inaccurate,Very Accurate,Very Inaccurate,Very Accurate,Very Inaccurate,Moderately Accurate,Moderately Accurate,Moderately Accurate,Moderately Accurate,Moderately Accurate,Moderately Accurate,Very Inaccurate,Very Inaccurate,Very Accurate,Very Inaccurate,Very Inaccurate,Very Inaccurate,Moderately Accurate,Very Inaccurate,Very Inaccurate,Very Inaccurate,Very Inaccurate,Very Accurate,Very Inaccurate,Very Accurate,Very Inaccurate,Neither inaccurate nor accurate,Very Inaccurate,Very Inaccurate,Very Accurate,Very Inaccurate,Very Accurate,Very Inaccurate,Very Accurate,Moderately Accurate,Moderately Accurate,Very Inaccurate,Very Inaccurate,Very Inaccurate,Very Inaccurate,Very Inaccurate,Very Inaccurate,Neither inaccurate nor accurate,Very Inaccurate,Moderately Accurate,Neither inaccurate nor accurate,Neither inaccurate nor accurate,Very Accurate,Moderately Accurate,Moderately Accurate,Moderately Accurate,Moderately Accurate,Moderately Accurate,Very Inaccurate,Very Inaccurate,Very Inaccurate,Neither inaccurate nor accurate,Very Inaccurate,Very Inaccurate,Very Inaccurate,Very Inaccurate,Moderately Accurate,Moderately Accurate,Moderately Accurate,Very Inaccurate,Moderately Accurate,Very Accurate,Very Accurate,Very Inaccurate,Very Accurate,Very Inaccurate,Very Accurate,Very Accurate,Very Accurate,Very Accurate,Very Inaccurate,Very Inaccurate,Very Inaccurate,Very Inaccurate,Moderately Accurate,Moderately Accurate,Very Inaccurate,Very Inaccurate,Very Inaccurate,Moderately Accurate,Very Inaccurate,Very Accurate,Neither inaccurate nor accurate,Very Inaccurate,Very Inaccurate,Moderately Accurate,Moderately Accurate,Moderately Accurate,Very Inaccurate,Moderately Accurate,Very Inaccurate,Moderately Accurate,Moderately Accurate,Moderately Accurate,Very Accurate,Very Accurate,Very Inaccurate,Moderately Accurate,Moderately Accurate,Moderately Inaccurate,Very Inaccurate,Very Inaccurate,Very Inaccurate,Very Inaccurate,Moderately Accurate,Neither inaccurate nor accurate,Very Inaccurate,Moderately Accurate,Neither inaccurate nor accurate,Moderately Accurate
id_268,Female,53,Canada,"Yes, English is my fluent language and also my native language.","1. Professional and technical (for example: doctor, teacher, engineer, artist, accountant, nurse)",7. Seventh step,6. Bachelor or equivalent (ISCED 6),2. Upper middle class,0. Do not belong to a denomination,Very Accurate,Moderately Accurate,Moderately Accurate,Neither inaccurate nor accurate,Moderately Accurate,Very Inaccurate,Moderately Accurate,Moderately Accurate,Moderately Accurate,Very Accurate,Moderately Inaccurate,Neither inaccurate nor accurate,Moderately Inaccurate,Neither inaccurate nor accurate,Moderately Inaccurate,Neither inaccurate nor accurate,Very Inaccurate,Moderately Accurate,Moderately Accurate,Neither inaccurate nor accurate,Moderately Accurate,Very Inaccurate,Neither inaccurate nor accurate,Moderately Inaccurate,Moderately Accurate,Moderately Inaccurate,Neither inaccurate nor accurate,Moderately Inaccurate,Neither inaccurate nor accurate,Moderately Accurate,Neither inaccurate nor accurate,Neither inaccurate nor accurate,Moderately Inaccurate,Very Accurate,Moderately Accurate,Moderately Accurate,Neither inaccurate nor accurate,Moderately Inaccurate,Moderately Accurate,Very Accurate,Moderately Accurate,Neither inaccurate nor accurate,Very Accurate,Very Accurate,Very Accurate,Very Accurate,Moderately Accurate,Moderately Accurate,Moderately Accurate,Moderately Inaccurate,Very Accurate,Moderately Accurate,Very Accurate,Very Accurate,Very Inaccurate,Very Accurate,Very Inaccurate,Neither inaccurate nor accurate,Very Inaccurate,Moderately Accurate,Very Accurate,Moderately Inaccurate,Moderately Inaccurate,Moderately Accurate,Very Accurate,Moderately Accurate,Very Accurate,Moderately Inaccurate,Neither inaccurate nor accurate,Very Inaccurate,Very Inaccurate,Very Inaccurate,Very Accurate,Very Inaccurate,Very Inaccurate,Moderately Accurate,Very Accurate,Moderately Inaccurate,Very Accurate,Moderately Inaccurate,Moderately Accurate,Very Accurate,Very Inaccurate,Neither inaccurate nor accurate,Neither inaccurate nor accurate,Moderately Accurate,Moderately Accurate,Very Accurate,Very Accurate,Very Inaccurate,Very Accurate,Very Inaccurate,Very Accurate,Neither inaccurate nor accurate,Neither inaccurate nor accurate,Moderately Accurate,Moderately Inaccurate,Very Accurate,Moderately Accurate,Moderately Accurate,Moderately Accurate,Very Inaccurate,Moderately Accurate,Neither inaccurate nor accurate,Very Accurate,Very Accurate,Very Accurate,Very Accurate,Moderately Accurate,Very Accurate,Very Inaccurate,Very Accurate,Very Accurate,Moderately Accurate,Moderately Inaccurate,Neither inaccurate nor accurate,Very Inaccurate,Neither inaccurate nor accurate,Very Inaccurate,Neither inaccurate nor accurate,Very Accurate,Very Accurate,Neither inaccurate nor accurate,Neither inaccurate nor accurate,Moderately Inaccurate,Moderately Accurate,Moderately Inaccurate,Moderately Accurate,Moderately Accurate,Very Accurate,Neither inaccurate nor accurate,Moderately Accurate,Very Accurate,Very Accurate,Moderately Inaccurate,Neither inaccurate nor accurate,Very Inaccurate,Very Inaccurate,Very Accurate,Moderately Accurate,Very Inaccurate,Very Accurate,Moderately Inaccurate,Neither inaccurate nor accurate,Very Accurate,Very Accurate,Moderately Accurate,Moderately Accurate,Very Inaccurate,Moderately Accurate,Very Inaccurate,Very Accurate,Moderately Accurate,Very Inaccurate,Very Inaccurate,Moderately Accurate,Very Inaccurate,Very Inaccurate,Very Inaccurate,Very Inaccurate,Very Accurate,Very Inaccurate,Very Accurate,Very Inaccurate,Moderately Accurate,Very Inaccurate,Very Inaccurate,Very Accurate,Neither inaccurate nor accurate,Very Accurate,Neither inaccurate nor accurate,Neither inaccurate nor accurate,Moderately Accurate,Neither inaccurate nor accurate,Neither inaccurate nor accurate,Moderately Accurate,Moderately Accurate,Moderately Inaccurate,Moderately Inaccurate,Very Inaccurate,Moderately Accurate,Moderately Accurate,Very Accurate,Very Inaccurate,Very Inaccurate,Very Accurate,Very Accurate,Very Inaccurate,Moderately Accurate,Very Accurate,Very Accurate,Neither inaccurate nor accurate,Very Inaccurate,Very Inaccurate,Moderately Accurate,Moderately Inaccurate,Moderately Inaccurate,Very Inaccurate,Very Inaccurate,Very Accurate,Moderately Accurate,Very Accurate,Very Inaccurate,Moderately Inaccurate,Moderately Accurate,Neither inaccurate nor accurate,Very Inaccurate,Neither inaccurate nor accurate,Very Inaccurate,Neither inaccurate nor accurate,Neither inaccurate nor accurate,Neither inaccurate nor accurate,Neither inaccurate nor accurate,Very Inaccurate,Very Inaccurate,Neither inaccurate nor accurate,Very Inaccurate,Very Accurate,Moderately Accurate,Very Inaccurate,Very Inaccurate,Moderately Inaccurate,Moderately Accurate,Moderately Accurate,Moderately Accurate,Moderately Inaccurate,Very Inaccurate,Very Inaccurate,Neither inaccurate nor accurate,Moderately Inaccurate,Neither inaccurate nor accurate,Very Inaccurate,Neither inaccurate nor accurate,Moderately Accurate,Moderately Accurate,Very Accurate,Moderately Inaccurate,Very Accurate,Moderately Accurate,Very Inaccurate,Very Inaccurate,Very Accurate,Very Accurate,Very Inaccurate,Moderately Inaccurate,Neither inaccurate nor accurate,Moderately Accurate,Very Accurate,Very Accurate,Moderately Inaccurate,Very Accurate,Very Inaccurate,Moderately Accurate
id_269,Male,35,United States of America,"Yes, English is my fluent language and also my native language.","8. Unskilled worker (for example: labourer, porter, unskilled factory worker, cleaner)",1. Lower step,1. Primary education (ISCED 1),5. Lower class,2. Protestant,Very Accurate,Very Inaccurate,Neither inaccurate nor accurate,Very Accurate,Neither inaccurate nor accurate,Very Inaccurate,Very Inaccurate,Very Inaccurate,Neither inaccurate nor accurate,Very Inaccurate,Very Accurate,Neither inaccurate nor accurate,Very Inaccurate,Neither inaccurate nor accurate,Very Inaccurate,Neither inaccurate nor accurate,Very Inaccurate,Very Inaccurate,Very Inaccurate,Very Accurate,Neither inaccurate nor accurate,Neither inaccurate nor accurate,Very Inaccurate,Very Accurate,Very Inaccurate,Very Accurate,Very Accurate,Very Inaccurate,Neither inaccurate nor accurate,Moderately Accurate,Neither inaccurate nor accurate,Very Inaccurate,Very Inaccurate,Very Accurate,Neither inaccurate nor accurate,Very Inaccurate,Neither inaccurate nor accurate,Very Accurate,Very Accurate,Neither inaccurate nor accurate,Neither inaccurate nor accurate,Very Accurate,Very Accurate,Neither inaccurate nor accurate,Very Accurate,Neither inaccurate nor accurate,Neither inaccurate nor accurate,Neither inaccurate nor accurate,Neither inaccurate nor accurate,Neither inaccurate nor accurate,Very Inaccurate,Very Accurate,Very Accurate,Very Accurate,Neither inaccurate nor accurate,Neither inaccurate nor accurate,Very Accurate,Very Accurate,Neither inaccurate nor accurate,Very Accurate,Very Accurate,Very Accurate,Neither inaccurate nor accurate,Neither inaccurate nor accurate,Neither inaccurate nor accurate,Neither inaccurate nor accurate,Very Accurate,Very Inaccurate,Very Accurate,Very Inaccurate,Very Accurate,Neither inaccurate nor accurate,Very Accurate,Neither inaccurate nor accurate,Very Inaccurate,Very Inaccurate,Moderately Accurate,Very Accurate,Very Accurate,Very Accurate,Very Accurate,Very Accurate,Very Accurate,Very Inaccurate,Very Accurate,Neither inaccurate nor accurate,Moderately Accurate,Very Accurate,Very Inaccurate,Very Inaccurate,Neither inaccurate nor accurate,Very Accurate,Very Inaccurate,Neither inaccurate nor accurate,Very Accurate,Very Accurate,Moderately Accurate,Very Inaccurate,Very Inaccurate,Very Accurate,Neither inaccurate nor accurate,Very Inaccurate,Very Accurate,Very Inaccurate,Very Accurate,Very Inaccurate,Neither inaccurate nor accurate,Very Accurate,Neither inaccurate nor accurate,Very Accurate,Very Inaccurate,Very Accurate,Neither inaccurate nor accurate,Very Accurate,Very Inaccurate,Very Accurate,Very Inaccurate,Neither inaccurate nor accurate,Very Accurate,Very Inaccurate,Neither inaccurate nor accurate,Very Accurate,Very Accurate,Neither inaccurate nor accurate,Very Inaccurate,Neither inaccurate nor accurate,Very Inaccurate,Neither inaccurate nor accurate,Very Inaccurate,Neither inaccurate nor accurate,Very Accurate,Very Accurate,Neither inaccurate nor accurate,Very Inaccurate,Very Accurate,Neither inaccurate nor accurate,Very Inaccurate,Very Accurate,Very Inaccurate,Very Accurate,Neither inaccurate nor accurate,Neither inaccurate nor accurate,Neither inaccurate nor accurate,Very Accurate,Very Accurate,Neither inaccurate nor accurate,Neither inaccurate nor accurate,Neither inaccurate nor accurate,Very Inaccurate,Neither inaccurate nor accurate,Very Inaccurate,Very Inaccurate,Very Inaccurate,Neither inaccurate nor accurate,Very Inaccurate,Very Accurate,Very Inaccurate,Very Inaccurate,Very Accurate,Neither inaccurate nor accurate,Very Accurate,Neither inaccurate nor accurate,Neither inaccurate nor accurate,Very Inaccurate,Very Inaccurate,Very Accurate,Very Accurate,Very Accurate,Very Accurate,Very Accurate,Very Inaccurate,Very Inaccurate,Very Inaccurate,Very Accurate,Very Accurate,Very Accurate,Very Accurate,Neither inaccurate nor accurate,Very Inaccurate,Very Accurate,Very Inaccurate,Very Inaccurate,Very Inaccurate,Very Accurate,Neither inaccurate nor accurate,Very Accurate,Neither inaccurate nor accurate,Neither inaccurate nor accurate,Neither inaccurate nor accurate,Neither inaccurate nor accurate,Very Inaccurate,Very Accurate,Very Inaccurate,Neither inaccurate nor accurate,Very Accurate,Very Inaccurate,Very Inaccurate,Neither inaccurate nor accurate,Neither inaccurate nor accurate,Neither inaccurate nor accurate,Neither inaccurate nor accurate,Neither inaccurate nor accurate,Neither inaccurate nor accurate,Very Accurate,Very Accurate,Neither inaccurate nor accurate,Neither inaccurate nor accurate,Very Accurate,Neither inaccurate nor accurate,Very Accurate,Very Inaccurate,Neither inaccurate nor accurate,Neither inaccurate nor accurate,Very Accurate,Neither inaccurate nor accurate,Moderately Accurate,Very Accurate,Neither inaccurate nor accurate,Very Accurate,Very Accurate,Neither inaccurate nor accurate,Very Accurate,Neither inaccurate nor accurate,Very Inaccurate,Neither inaccurate nor accurate,Neither inaccurate nor accurate,Very Inaccurate,Very Accurate,Very Inaccurate,Neither inaccurate nor accurate,Very Inaccurate,Neither inaccurate nor accurate,Neither inaccurate nor accurate,Very Accurate,Very Inaccurate,Neither inaccurate nor accurate,Neither inaccurate nor accurate,Neither inaccurate nor accurate,Very Inaccurate,Neither inaccurate nor accurate,Very Inaccurate,Very Accurate,Neither inaccurate nor accurate,Neither inaccurate nor accurate,Neither inaccurate nor accurate,Neither inaccurate nor accurate,Neither inaccurate nor accurate,Neither inaccurate nor accurate,Very Accurate,Neither inaccurate nor accurate,Neither inaccurate nor accurate,Neither inaccurate nor accurate,Very Accurate
