Participant_ID,Gender,Age,Country,English,Occupation,Income,Education,Social_class,Religion,N1,N2,N3,N4,N5,N6,N7,N8,N9,N10,N11,N12,N13,N14,N15,N16,N17,N18,N19,N20,N21,N22,N23,N24,N25,N26,N27,N28,N29,N30,N31,N32,N33,N34,N35,N36,N37,N38,N39,N40,N41,N42,N43,N44,N45,N46,N47,N48,N49,N50,N51,N52,N53,N54,N55,N56,N57,N58,N59,N60,N61,N62,N63,N64,N65,N66,N67,N68,N69,N70,N71,N72,N73,N74,N75,N76,N77,N78,N79,N80,N81,N82,N83,N84,N85,N86,N87,N88,N89,N90,N91,N92,N93,N94,N95,N96,N97,N98,N99,N100,N101,N102,N103,N104,N105,N106,N107,N108,N109,N110,N111,N112,N113,N114,N115,N116,N117,N118,N119,N120,N121,N122,N123,N124,N125,N126,N127,N128,N129,N130,N131,N132,N133,N134,N135,N136,N137,N138,N139,N140,N141,N142,N143,N144,N145,N146,N147,N148,N149,N150,N151,N152,N153,N154,N155,N156,N157,N158,N159,N160,N161,N162,N163,N164,N165,N166,N167,N168,N169,N170,N171,N172,N173,N174,N175,N176,N177,N178,N179,N180,N181,N182,N183,N184,N185,N186,N187,N188,N189,N190,N191,N192,N193,N194,N195,N196,N197,N198,N199,N200,N201,N202,N203,N204,N205,N206,N207,N208,N209,N210,N211,N212,N213,N214,N215,N216,N217,N218,N219,N220,N221,N222,N223,N224,N225,N226,N227,N228,N229,N230,N231,N232,N233,N234,N235,N236,N237,N238,N239,N240,N241,N242,N243,N244,N245,N246,N247,N248,N249,N250,N251,N252,N253
id_250,Male,36,South Africa,"Yes, English is my fluent language and also my native language.","2. Higher administrative (for example: banker, executive in big business, high government official, union official)",7. Seventh step,6. Bachelor or equivalent (ISCED 6),2. Upper middle class,5. Muslim,Moderately Accurate,Moderately Accurate,Very Accurate,Neither inaccurate nor accurate,Moderately Inaccurate,Moderately Inaccurate,Moderately Accurate,Neither inaccurate nor accurate,Neither inaccurate nor accurate,Moderately Inaccurate,Very Inaccurate,Neither inaccurate nor accurate,Very Inaccurate,Moderately Inaccurate,Neither inaccurate nor accurate,Moderately Inaccurate,Very Inaccurate,Neither inaccurate nor accurate,Very Inaccurate,Moderately Accurate,Neither inaccurate nor accurate,Moderately Inaccurate,Very Inaccurate,Neither inaccurate nor accurate,Moderately Inaccurate,Moderately Accurate,Moderately Inaccurate,Very Inaccurate,Moderately Inaccurate,Neither inaccurate nor accurate,Very Inaccurate,Moderately Accurate,Moderately Inaccurate,Neither inaccurate nor accurate,Moderately Accurate,Neither inaccurate nor accurate,Moderately Accurate,Moderately Inaccurate,Moderately Accurate,Neither inaccurate nor accurate,Moderately Accurate,Moderately Accurate,Very Accurate,Moderately Accurate,Moderately Accurate,Neither inaccurate nor accurate,Moderately Accurate,Moderately Accurate,Moderately Inaccurate,Moderately Inaccurate,Moderately Inaccurate,Very Inaccurate,Neither inaccurate nor accurate,Moderately Accurate,Moderately Inaccurate,Moderately Inaccurate,Very Inaccurate,Moderately Inaccurate,Moderately Inaccurate,Neither inaccurate nor accurate,Moderately Accurate,Neither inaccurate nor accurate,Moderately Inaccurate,Moderately Inaccurate,Moderately Accurate,Moderately Accurate,Moderately Accurate,Moderately Inaccurate,Moderately Accurate,Very Inaccurate,Moderately Inaccurate,Neither inaccurate nor accurate,Very Accurate,Moderately Inaccurate,Very Inaccurate,Neither inaccurate nor accurate,Moderately Accurate,Moderately Inaccurate,Moderately Accurate,Moderately Accurate,Neither inaccurate nor accurate,Moderately Accurate,Very Inaccurate,Very Inaccurate,Moderately Inaccurate,Moderately Accurate,Moderately Inaccurate,Moderately Accurate,Moderately Accurate,Moderately Inaccurate,Moderately Accurate,Neither inaccurate nor accurate,Neither inaccurate nor accurate,Moderately Inaccurate,Moderately Accurate,Moderately Accurate,Moderately Accurate,Moderately Accurate,Moderately Accurate,Neither inaccurate nor accurate,Neither inaccurate nor accurate,Neither inaccurate nor accurate,Moderately Inaccurate,Neither inaccurate nor accurate,Very Accurate,Moderately Accurate,Very Accurate,Very Accurate,Neither inaccurate nor accurate,Moderately Accurate,Very Inaccurate,Moderately Accurate,Moderately Accurate,Moderately Inaccurate,Very Inaccurate,Neither inaccurate nor accurate,Moderately Inaccurate,Moderately Inaccurate,Moderately Accurate,Moderately Inaccurate,Moderately Accurate,Moderately Accurate,Moderately Inaccurate,Neither inaccurate nor accurate,Neither inaccurate nor accurate,Very Accurate,Moderately Inaccurate,Moderately Inaccurate,Very Inaccurate,Moderately Accurate,Neither inaccurate nor accurate,Very Accurate,Very Accurate,Neither inaccurate nor accurate,Moderately Inaccurate,Moderately Inaccurate,Very Inaccurate,Moderately Inaccurate,Very Inaccurate,Moderately Inaccurate,Moderately Inaccurate,Moderately Accurate,Very Inaccurate,Moderately Inaccurate,Neither inaccurate nor accurate,Moderately Accurate,Very Accurate,Very Accurate,Moderately Inaccurate,Neither inaccurate nor accurate,Very Inaccurate,Moderately Accurate,Moderately Inaccurate,Moderately Inaccurate,Very Inaccurate,Moderately Accurate,Very Inaccurate,Moderately Inaccurate,Moderately Inaccurate,Very Inaccurate,Moderately Accurate,Neither inaccurate nor accurate,Moderately Accurate,Moderately Inaccurate,Neither inaccurate nor accurate,Moderately Inaccurate,Moderately Inaccurate,Moderately Accurate,Moderately Inaccurate,Moderately Accurate,Very Inaccurate,Moderately Inaccurate,Moderately Accurate,Neither inaccurate nor accurate,Moderately Inaccurate,Very Inaccurate,Very Inaccurate,Moderately Accurate,Moderately Inaccurate,Moderately Inaccurate,Very Inaccurate,Very Inaccurate,Moderately Accurate,Moderately Inaccurate,Neither inaccurate nor accurate,Moderately Accurate,Moderately Inaccurate,Moderately Inaccurate,Very Inaccurate,Moderately Accurate,Very Accurate,Neither inaccurate nor accurate,Moderately Inaccurate,Moderately Inaccurate,Neither inaccurate nor accurate,Very Inaccurate,Very Inaccurate,Moderately Inaccurate,Moderately Inaccurate,Moderately Accurate,Moderately Accurate,Very Accurate,Moderately Inaccurate,Moderately Accurate,Moderately Accurate,Neither inaccurate nor accurate,Very Inaccurate,Moderately Inaccurate,Moderately Inaccurate,Moderately Accurate,Neither inaccurate nor accurate,Neither inaccurate nor accurate,Neither inaccurate nor accurate,Moderately Accurate,Very Inaccurate,Neither inaccurate nor accurate,Moderately Accurate,Moderately Accurate,Neither inaccurate nor accurate,Neither inaccurate nor accurate,Very Inaccurate,Very Accurate,Neither inaccurate nor accurate,Moderately Inaccurate,Moderately Accurate,Moderately Inaccurate,Very Inaccurate,Moderately Inaccurate,Moderately Accurate,Moderately Inaccurate,Moderately Inaccurate,Moderately Inaccurate,Neither inaccurate nor accurate,Neither inaccurate nor accurate,Moderately Accurate,Moderately Accurate,Very Accurate,Moderately Accurate,Neither inaccurate nor accurate,Moderately Inaccurate,Neither inaccurate nor accurate,Moderately Accurate,Moderately Accurate,Very Accurate,Moderately Inaccurate,Neither inaccurate nor accurate,Very Accurate,Neither inaccurate nor accurate,Moderately Accurate,Moderately Inaccurate,Very Accurate,Very Accurate,Neither inaccurate nor accurate
id_251,Female,45,United Kingdom of Great Britain and Northern Ireland,"Yes, English is my fluent language and also my native language.","4. Sales (for example: sales manager, shop owner, shop assistant, insurance agent, buyer)",8. Eight step,3. Upper secondary education (ISCED 3),2. Upper middle class,0. Do not belong to a denomination,Very Accurate,Moderately Accurate,Very Accurate,Neither inaccurate nor accurate,Very Accurate,Very Inaccurate,Moderately Accurate,Moderately Accurate,Neither inaccurate nor accurate,Very Accurate,Neither inaccurate nor accurate,Moderately Accurate,Moderately Inaccurate,Moderately Inaccurate,Moderately Inaccurate,Moderately Inaccurate,Very Inaccurate,Very Inaccurate,Neither inaccurate nor accurate,Moderately Accurate,Moderately Inaccurate,Moderately Inaccurate,Very Accurate,Moderately Accurate,Moderately Inaccurate,Very Accurate,Very Accurate,Moderately Inaccurate,Moderately Accurate,Neither inaccurate nor accurate,Very Inaccurate,Moderately Accurate,Very Inaccurate,Moderately Accurate,Moderately Accurate,Moderately Accurate,Neither inaccurate nor accurate,Very Inaccurate,Moderately Accurate,Moderately Accurate,Moderately Accurate,Moderately Inaccurate,Moderately Accurate,Moderately Accurate,Moderately Accurate,Very Accurate,Very Accurate,Very Accurate,Very Accurate,Very Accurate,Very Accurate,Very Accurate,Moderately Accurate,Moderately Accurate,Neither inaccurate nor accurate,Moderately Accurate,Moderately Inaccurate,Moderately Accurate,Neither inaccurate nor accurate,Moderately Accurate,Very Accurate,Moderately Inaccurate,Moderately Inaccurate,Moderately Inaccurate,Moderately Accurate,Very Accurate,Moderately Accurate,Very Inaccurate,Moderately Accurate,Very Inaccurate,Moderately Inaccurate,Moderately Inaccurate,Very Accurate,Moderately Inaccurate,Very Inaccurate,Moderately Accurate,Moderately Accurate,Very Inaccurate,Moderately Accurate,Moderately Accurate,Moderately Accurate,Moderately Accurate,Moderately Inaccurate,Very Accurate,Moderately Accurate,Very Accurate,Very Inaccurate,Moderately Accurate,Moderately Accurate,Very Inaccurate,Very Accurate,Very Inaccurate,Moderately Accurate,Neither inaccurate nor accurate,Moderately Inaccurate,Moderately Accurate,Moderately Accurate,Moderately Accurate,Moderately Accurate,Moderately Accurate,Moderately Inaccurate,Moderately Inaccurate,Neither inaccurate nor accurate,Very Inaccurate,Very Accurate,Moderately Accurate,Very Accurate,Moderately Accurate,Moderately Accurate,Very Accurate,Very Inaccurate,Moderately Accurate,Very Accurate,Moderately Accurate,Very Inaccurate,Very Accurate,Moderately Inaccurate,Moderately Inaccurate,Neither inaccurate nor accurate,Moderately Inaccurate,Moderately Accurate,Very Accurate,Neither inaccurate nor accurate,Moderately Inaccurate,Very Inaccurate,Very Accurate,Moderately Inaccurate,Neither inaccurate nor accurate,Moderately Inaccurate,Moderately Accurate,Neither inaccurate nor accurate,Moderately Accurate,Very Accurate,Very Accurate,Neither inaccurate nor accurate,Moderately Inaccurate,Very Inaccurate,Moderately Accurate,Moderately Inaccurate,Very Inaccurate,Moderately Inaccurate,Moderately Accurate,Very Inaccurate,Moderately Inaccurate,Very Accurate,Moderately Accurate,Very Accurate,Very Accurate,Very Inaccurate,Moderately Accurate,Very Inaccurate,Very Accurate,Moderately Inaccurate,Moderately Inaccurate,Very Inaccurate,Moderately Accurate,Very Inaccurate,Very Inaccurate,Neither inaccurate nor accurate,Moderately Inaccurate,Very Accurate,Moderately Inaccurate,Moderately Accurate,Very Inaccurate,Moderately Inaccurate,Moderately Inaccurate,Neither inaccurate nor accurate,Moderately Accurate,Moderately Accurate,Very Accurate,Very Inaccurate,Moderately Accurate,Moderately Accurate,Moderately Accurate,Moderately Inaccurate,Moderately Inaccurate,Moderately Accurate,Neither inaccurate nor accurate,Moderately Inaccurate,Moderately Inaccurate,Neither inaccurate nor accurate,Very Inaccurate,Moderately Accurate,Moderately Inaccurate,Moderately Accurate,Neither inaccurate nor accurate,Moderately Inaccurate,Moderately Inaccurate,Very Inaccurate,Neither inaccurate nor accurate,Very Accurate,Moderately Accurate,Very Inaccurate,Neither inaccurate nor accurate,Very Accurate,Very Inaccurate,Very Inaccurate,Moderately Inaccurate,Moderately Inaccurate,Moderately Accurate,Moderately Accurate,Moderately Accurate,Moderately Inaccurate,Moderately Accurate,Moderately Accurate,Moderately Inaccurate,Very Inaccurate,Moderately Accurate,Moderately Accurate,Moderately Accurate,Moderately Inaccurate,Very Accurate,Moderately Accurate,Moderately Accurate,Very Inaccurate,Moderately Accurate,Moderately Accurate,Moderately Accurate,Moderately Accurate,Moderately Accurate,Moderately Inaccurate,Moderately Inaccurate,Moderately Inaccurate,Very Inaccurate,Moderately Accurate,Moderately Inaccurate,Very Inaccurate,Neither inaccurate nor accurate,Moderately Accurate,Neither inaccurate nor accurate,Moderately Inaccurate,Moderately Inaccurate,Neither inaccurate nor accurate,Moderately Inaccurate,Moderately Accurate,Moderately Accurate,Moderately Accurate,Neither inaccurate nor accurate,Moderately Inaccurate,Moderately Inaccurate,Moderately Inaccurate,Moderately Accurate,Neither inaccurate nor accurate,Moderately Accurate,Moderately Accurate,Neither inaccurate nor accurate,Moderately Inaccurate,Moderately Inaccurate,Moderately Accurate,Moderately Inaccurate,Moderately Accurate,Very Accurate,Moderately Accurate
id_252,Male,26,Kenya,"Yes, English is my fluent language.","1. Professional and technical (for example: doctor, teacher, engineer, artist, accountant, nurse)",7. Seventh step,6. Bachelor or equivalent (ISCED 6),3. Lower middle class,2. Protestant,Moderately Accurate,Moderately Inaccurate,Very Accurate,Very Inaccurate,Moderately Inaccurate,Very Inaccurate,Moderately Accurate,Very Accurate,Moderately Inaccurate,Very Accurate,Moderately Inaccurate,Moderately Accurate,Very Accurate,Very Inaccurate,Neither inaccurate nor accurate,Moderately Inaccurate,Moderately Accurate,Very Accurate,Moderately Inaccurate,Very Inaccurate,Moderately Accurate,Moderately Inaccurate,Moderately Accurate,Moderately Accurate,Moderately Inaccurate,Very Inaccurate,Very Inaccurate,Very Inaccurate,Moderately Inaccurate,Very Accurate,Moderately Inaccurate,Very Accurate,Very Inaccurate,Moderately Accurate,Neither inaccurate nor accurate,Moderately Inaccurate,Very Accurate,Very Accurate,Very Inaccurate,Moderately Accurate,Moderately Inaccurate,Very Inaccurate,Very Accurate,Moderately Inaccurate,Neither inaccurate nor accurate,Moderately Inaccurate,Moderately Accurate,Moderately Inaccurate,Very Accurate,Moderately Inaccurate,Moderately Accurate,Very Inaccurate,Moderately Accurate,Very Accurate,Moderately Accurate,Very Inaccurate,Moderately Inaccurate,Very Inaccurate,Very Accurate,Moderately Inaccurate,Very Accurate,Very Inaccurate,Moderately Inaccurate,Very Accurate,Very Accurate,Neither inaccurate nor accurate,Very Accurate,Very Inaccurate,Very Inaccurate,Neither inaccurate nor accurate,Moderately Accurate,Moderately Accurate,Moderately Inaccurate,Very Inaccurate,Very Inaccurate,Very Inaccurate,Moderately Inaccurate,Moderately Inaccurate,Very Accurate,Moderately Inaccurate,Very Accurate,Very Accurate,Moderately Inaccurate,Very Inaccurate,Very Inaccurate,Moderately Inaccurate,Very Inaccurate,Moderately Accurate,Very Inaccurate,Neither inaccurate nor accurate,Very Accurate,Very Inaccurate,Moderately Accurate,Moderately Accurate,Very Accurate,Very Accurate,Very Accurate,Moderately Accurate,Very Inaccurate,Very Inaccurate,Very Accurate,Very Inaccurate,Very Accurate,Very Inaccurate,Moderately Accurate,Moderately Inaccurate,Very Accurate,Moderately Accurate,Moderately Inaccurate,Moderately Accurate,Very Inaccurate,Moderately Inaccurate,Moderately Accurate,Very Accurate,Very Inaccurate,Very Accurate,Moderately Inaccurate,Very Inaccurate,Very Accurate,Very Accurate,Moderately Inaccurate,Moderately Accurate,Very Accurate,Very Inaccurate,Very Accurate,Very Accurate,Moderately Inaccurate,Very Inaccurate,Moderately Accurate,Moderately Accurate,Very Accurate,Moderately Accurate,Very Accurate,Moderately Accurate,Moderately Accurate,Very Accurate,Very Inaccurate,Moderately Accurate,Moderately Inaccurate,Very Accurate,Moderately Inaccurate,Very Accurate,Neither inaccurate nor accurate,Very Accurate,Very Accurate,Moderately Accurate,Moderately Accurate,Very Accurate,Very Accurate,Moderately Inaccurate,Very Inaccurate,Very Accurate,Very Inaccurate,Moderately Inaccurate,Moderately Inaccurate,Moderately Inaccurate,Very Inaccurate,Very Inaccurate,Very Inaccurate,Very Inaccurate,Very Accurate,Very Inaccurate,Very Accurate,Moderately Inaccurate,Very Accurate,Very Inaccurate,Very Accurate,Very Accurate,Moderately Accurate,Very Accurate,Very Accurate,Very Inaccurate,Moderately Accurate,Moderately Inaccurate,Very Accurate,Very Accurate,Very Inaccurate,Moderately Inaccurate,Very Inaccurate,Moderately Inaccurate,Very Inaccurate,Neither inaccurate nor accurate,Moderately Inaccurate,Moderately Accurate,Very Inaccurate,Very Accurate,Very Accurate,Moderately Accurate,Very Accurate,Moderately Inaccurate,Very Inaccurate,Neither inaccurate nor accurate,Very Inaccurate,Moderately Accurate,Very Inaccurate,Very Accurate,Very Accurate,Moderately Inaccurate,Moderately Accurate,Very Accurate,Moderately Accurate,Very Accurate,Moderately Inaccurate,Very Inaccurate,Very Accurate,Very Accurate,Very Inaccurate,Very Accurate,Very Inaccurate,Very Accurate,Very Inaccurate,Moderately Inaccurate,Moderately Accurate,Moderately Accurate,Very Inaccurate,Moderately Inaccurate,Very Inaccurate,Moderately Accurate,Very Accurate,Very Inaccurate,Very Inaccurate,Very Accurate,Very Accurate,Very Inaccurate,Moderately Accurate,Moderately Accurate,Very Inaccurate,Moderately Accurate,Moderately Inaccurate,Moderately Accurate,Moderately Accurate,Moderately Inaccurate,Neither inaccurate nor accurate,Very Inaccurate,Moderately Inaccurate,Moderately Inaccurate,Very Accurate,Very Accurate,Very Inaccurate,Moderately Inaccurate,Very Accurate,Moderately Inaccurate,Moderately Inaccurate,Very Inaccurate,Moderately Inaccurate,Very Inaccurate,Very Inaccurate,Very Accurate,Moderately Inaccurate,Moderately Inaccurate,Very Accurate,Moderately Accurate,Very Accurate
id_253,Female,28,South Africa,"Yes, English is my fluent language and also my native language.","3. Clerical (for example: secretary, clerk, office manager, civil servant, bookkeeper)",6. Sixth step,6. Bachelor or equivalent (ISCED 6),3. Lower middle class,8. Other Christian (Evangelical/Pentecostal/Fee church/etc.),Moderately Accurate,Moderately Inaccurate,Very Accurate,Moderately Accurate,Very Accurate,Very Inaccurate,Moderately Accurate,Very Inaccurate,Moderately Accurate,Moderately Accurate,Moderately Inaccurate,Neither inaccurate nor accurate,Very Inaccurate,Moderately Inaccurate,Very Inaccurate,Very Inaccurate,Very Inaccurate,Very Accurate,Moderately Accurate,Very Inaccurate,Very Accurate,Very Inaccurate,Very Accurate,Neither inaccurate nor accurate,Very Inaccurate,Moderately Accurate,Moderately Inaccurate,Very Inaccurate,Very Accurate,Very Accurate,Neither inaccurate nor accurate,Moderately Accurate,Very Inaccurate,Very Accurate,Moderately Accurate,Moderately Inaccurate,Moderately Inaccurate,Very Accurate,Moderately Accurate,Moderately Accurate,Moderately Accurate,Moderately Accurate,Moderately Accurate,Moderately Inaccurate,Very Accurate,Moderately Accurate,Very Accurate,Moderately Accurate,Very Accurate,Very Accurate,Very Accurate,Moderately Accurate,Very Accurate,Moderately Accurate,Moderately Inaccurate,Moderately Accurate,Very Inaccurate,Moderately Accurate,Moderately Inaccurate,Very Inaccurate,Very Accurate,Moderately Inaccurate,Very Inaccurate,Very Accurate,Moderately Accurate,Very Accurate,Very Accurate,Very Inaccurate,Moderately Accurate,Very Inaccurate,Very Inaccurate,Very Inaccurate,Very Accurate,Moderately Accurate,Very Inaccurate,Moderately Accurate,Very Accurate,Neither inaccurate nor accurate,Very Accurate,Moderately Inaccurate,Very Accurate,Very Accurate,Very Inaccurate,Very Inaccurate,Moderately Inaccurate,Moderately Accurate,Very Inaccurate,Very Accurate,Very Accurate,Very Inaccurate,Very Accurate,Very Inaccurate,Very Accurate,Moderately Accurate,Very Accurate,Very Accurate,Very Accurate,Very Accurate,Moderately Accurate,Moderately Accurate,Very Accurate,Very Inaccurate,Very Accurate,Very Inaccurate,Very Accurate,Moderately Inaccurate,Very Accurate,Very Accurate,Very Accurate,Very Accurate,Very Inaccurate,Moderately Accurate,Very Accurate,Moderately Accurate,Very Inaccurate,Very Accurate,Very Inaccurate,Very Inaccurate,Very Inaccurate,Moderately Inaccurate,Moderately Accurate,Very Accurate,Moderately Accurate,Very Inaccurate,Moderately Inaccurate,Very Accurate,Very Inaccurate,Moderately Inaccurate,Very Inaccurate,Moderately Accurate,Moderately Accurate,Moderately Inaccurate,Very Accurate,Very Accurate,Moderately Inaccurate,Moderately Inaccurate,Very Inaccurate,Very Inaccurate,Moderately Accurate,Moderately Accurate,Very Inaccurate,Moderately Inaccurate,Neither inaccurate nor accurate,Moderately Accurate,Very Accurate,Very Accurate,Very Accurate,Very Accurate,Moderately Accurate,Moderately Inaccurate,Very Inaccurate,Very Accurate,Very Inaccurate,Moderately Inaccurate,Very Inaccurate,Very Accurate,Very Inaccurate,Very Inaccurate,Moderately Accurate,Very Inaccurate,Very Accurate,Moderately Accurate,Very Inaccurate,Very Inaccurate,Moderately Accurate,Moderately Inaccurate,Moderately Accurate,Very Accurate,Moderately Inaccurate,Very Accurate,Very Inaccurate,Very Inaccurate,Moderately Accurate,Neither inaccurate nor accurate,Moderately Accurate,Moderately Accurate,Very Inaccurate,Very Inaccurate,Very Inaccurate,Very Inaccurate,Moderately Inaccurate,Very Inaccurate,Moderately Inaccurate,Very Inaccurate,Very Inaccurate,Very Accurate,Moderately Accurate,Moderately Inaccurate,Very Accurate,Neither inaccurate nor accurate,Moderately Inaccurate,Moderately Accurate,Very Inaccurate,Moderately Inaccurate,Moderately Inaccurate,Very Inaccurate,Neither inaccurate nor accurate,Very Inaccurate,Very Inaccurate,Very Accurate,Very Accurate,Very Accurate,Very Inaccurate,Very Accurate,Neither inaccurate nor accurate,Very Accurate,Very Inaccurate,Very Accurate,Neither inaccurate nor accurate,Moderately Accurate,Moderately Inaccurate,Moderately Accurate,Moderately Inaccurate,Neither inaccurate nor accurate,Very Inaccurate,Very Inaccurate,Neither inaccurate nor accurate,Moderately Accurate,Very Accurate,Moderately Inaccurate,Moderately Inaccurate,Very Accurate,Moderately Accurate,Very Inaccurate,Moderately Inaccurate,Moderately Accurate,Very Inaccurate,Moderately Accurate,Very Accurate,Moderately Accurate,Very Accurate,Moderately Inaccurate,Moderately Inaccurate,Moderately Accurate,Moderately Inaccurate,Moderately Inaccurate,Moderately Inaccurate,Very Accurate,Neither inaccurate nor accurate,Very Inaccurate,Moderately Inaccurate,Moderately Inaccurate,Neither inaccurate nor accurate,Very Inaccurate,Moderately Inaccurate,Moderately Accurate,Moderately Inaccurate,Very Accurate,Moderately Inaccurate,Moderately Inaccurate,Very Accurate,Very Inaccurate,Very Accurate
